[
  {"id":"festival-bhishma-ashtami","slug":"bhishma-ashtami","name":"भीष्म अष्टमी","what":"भीष्म अष्टमी, माघ शुक्ल अष्टमी, महाभारत के ओह बूढ़ पितामह के याद के दिन होला जे देह छोड़े खातिर उत्तरायण के बाट जोहलन। लोग दुपहरिया में भीष्म के नाँव से तर्पण, तिल आ कुश के संगे पानी, चढ़ावेला, ऊ लोग भी जिनकर आपन बाबूजी जियत बाड़न, काहे कि भीष्म के कवनो संतान ना रहे जे उनका खातिर ई करित। नहान आ तर्पण पूरा होखे ले बरत के परंपरा बा, आ भीष्म स्तवराज भा विष्णु सहस्रनाम, जेकरा भीष्म के कहल मानल जाला, पढ़ल जाला। ढेर लोग ई दिन सगरी पुरखा खातिर भी राखेला।","rule":"भीष्म अष्टमी माघ शुक्ल अष्टमी (पूर्णिमांत महीना के नाँव) के पड़ेला; दिन ऊ लिहल जाला जवना दिन ई तिथि मध्याह्न (दुपहरिया) में होखे, आ अगर तिथि दू दिन ओह अवधि के छुवे त ऊ दिन लिहल जाला जवना दिन ऊ ओकर बेसी हिस्सा पर रहे।","conventionNote":"मध्याह्न (सूर्योदय से आधा दिनमान बीतला पर) के घरी पर आँकल जाला, काहे कि तर्पण दुपहरिया के विधि होला; तारीख सूर्योदय के तिथि से एक दिन अलग हो सकेला। शुक्ल पक्ष, एह से पूर्णिमांत आ अमांत में कवनो फरक नइखे।","review":"draft"},
  {"id":"festival-jaya-ekadashi","slug":"jaya-ekadashi","name":"जया एकादशी","what":"जया एकादशी माघ के शुक्ल पक्ष के एकादशी होला। हर एकादशी जइसन एकरा अन्न आ दाल छोड़ के राखल जाला, आपन ताकत के हिसाब से फल, दूध भा पानी पर, आ दिन पाठ, जप भा कवनो विष्णु मंदिर जाए में दिहल जाला। पद्म पुराण के एकर कथा एगो दिव्य जोड़ी के बा, जे बिना जनले ई बरत राख के एगो शाप से छूटल। बरत अगिला भोरे द्वादशी के भीतर पारन के संगे खतम होला, हरि वासर बीतला के बाद आ दिन के पाँचवाँ हिस्सा बीतला से पहिले।","rule":"जया एकादशी माघ शुक्ल एकादशी (पूर्णिमांत महीना के नाँव) के पड़ेला; दिन ऊ लिहल जाला जेकरा सूर्योदय पर ई तिथि होखे, आ अगर तिथि दू दिन ओह समय पर रहे त बाद वाला दिन लिहल जाला; अगर अगिला द्वादशी कवनो सूर्योदय के ना छुवे, त बरत ओही दिन रहेला जवना दिन एकादशी शुरू भइल, जेसे पारन द्वादशी के भीतर पड़े।","conventionNote":"एकादशी नियम: स्मार्त तारीख सूर्योदय के तिथि पर, दू सूर्योदय पर एकादशी होखे त बाद वाला दिन, आ वैष्णव तारीख एक दिन बाद जब दशमी भोर में भी चलत होखे; ऐप दुनो देखावेला। शुक्ल पक्ष, एह से पूर्णिमांत आ अमांत में कवनो फरक नइखे।","review":"draft"},
  {"id":"festival-amalaki-ekadashi","slug":"amalaki-ekadashi","name":"आमलकी एकादशी","what":"आमलकी एकादशी फागुन के शुक्ल पक्ष के एकादशी होला, जे आंवला (आमलकी) के गाछ के समर्पित बा, जवना में विष्णु के निवास कहल जाला। आम अन्न छोड़ल आ विष्णु पूजा के संगे लोग आंवला के गाछ में पानी देला, ओकर परिक्रमा करेला, ओह पर तागा बान्हेला आ, जहाँ हो सके, ओकरा तर खाना खाला; आंवला के फल दान कइल जाला आ अगिला दिन खाइल जाला। होली से लगभग दस दिन पहिले पड़े के कारन बनारस में एकरा रंगभरी एकादशी भी कहल जाला, जहाँ विश्वनाथ मंदिर में शिव आ पार्वती के रंग से स्वागत होला।","rule":"आमलकी एकादशी फागुन शुक्ल एकादशी (पूर्णिमांत महीना के नाँव) के पड़ेला; दिन ऊ लिहल जाला जेकरा सूर्योदय पर ई तिथि होखे, आ अगर तिथि दू दिन ओह समय पर रहे त बाद वाला दिन लिहल जाला; अगर अगिला द्वादशी कवनो सूर्योदय के ना छुवे, त बरत ओही दिन रहेला जवना दिन एकादशी शुरू भइल, जेसे पारन द्वादशी के भीतर पड़े।","conventionNote":"एकादशी नियम, स्मार्त आ वैष्णव दुनो तारीख के संगे। शुक्ल पक्ष: पूर्णिमांत आ अमांत में कवनो फरक नइखे।","review":"draft"},
  {"id":"festival-holika-dahan","slug":"holika-dahan","name":"सम्मत (होलिका दहन)","what":"सम्मत (होलिका दहन) फागुन पूर्णिमा के साँझ, होली से पहिले के रात, के आगि होला। पिछला हफ्ता में कवनो सार्वजनिक जगह पर लकड़ी, गोइठा आ सुखल डाढ़ के ढेर बनावल जाला आ सूर्यास्त के बाद प्रदोष काल में, भद्रा करण बीतला पर, ओकरा जरावल जाला। लोग आगि के परिक्रमा करेला, नया अन्न, नारियल आ चना चढ़ावेला, थोड़िका आगि घरे ले जाला आ ओह में ताजा गेहूँ आ चना भूँजेला। कथा बा प्रह्लाद के ओह आगि में सुरक्षा के, जे होलिका के ले लिहलस। अगिला दिन रंग के खेल होला।","rule":"सम्मत (होलिका दहन) फागुन शुक्ल पूर्णिमा (पूर्णिमांत महीना के नाँव) के पड़ेला; दिन ऊ लिहल जाला जवना दिन ई तिथि प्रदोष काल (साँझ, रात के पहिला दसवाँ हिस्सा) में होखे, आ अगर तिथि दू दिन ओह समय पर रहे त बाद वाला दिन लिहल जाला, आ समय-खिड़की पर पड़े वाला कवनो भद्रा (विष्टि करण) के बीतला के बाद ही पर्व मनावल जाला।","conventionNote":"प्रदोष नियम, जब पूर्णिमा दू साँझ के होखे त बाद वाला दिन पहिले, आ आगि भद्रा (विष्टि) के खतम होखे के बाट जोहेला; जब भद्रा पूरा प्रदोष काल में चले, त पंचांग भद्रा के बाद भा पहिले आगि के अनुमति देला, आ स्थानीय चलन अलग-अलग बा। पूर्णिमा के कैलेंडर तारीख पूर्णिमांत आ अमांत में एके होला। 2026 में 3 मार्च के चंद्रग्रहण बेसी पंचांग में आगि के एक दिन आगे ले जाला; इंजन में अबहीं ग्रहण के नियम नइखे।","review":"draft"},
  {"id":"festival-holi","slug":"holi","name":"होली (धुलंडी)","what":"होली, भा धुलंडी आ धुलेटी, सम्मत (होलिका दहन) के अगिला दिन, चइत कृष्ण पक्ष के पहिला दिन, रंग के भोर होला। भोरे-भोरे से लोग अबीर आ रंगल पानी डालेला, दोस्त आ नात-रिश्तेदार के घरे जाला, आ गुझिया, मालपुआ आ ठंडाई खाला-पीयेला। दुपहरिया ले रंग धो लिहल जाला आ साँझ नया कपड़ा आ मिलन-जुलन के होला। मथुरा के आस-पास ब्रज बरसाना के लट्ठमार होली के संगे हफ्ता भर होली राखेला; बंगाल झूला पर कृष्ण के संगे दोल जात्रा राखेला; पंजाब के होला मोहल्ला अगिला दिन आवेला।","rule":"होली (धुलंडी) सम्मत (होलिका दहन) के 1 दिन बाद होला।","conventionNote":"अंतर-नियम: सम्मत (होलिका दहन) के अगिला कैलेंडर दिन, सूर्योदय के तिथि जे भी होखे। अमांत गणना में ई दिन अबहियो फागुन (कृष्ण पक्ष) होला, पूर्णिमांत में चइत कृष्ण प्रतिपदा; तारीख ओही होला।","review":"draft"},
  {"id":"festival-gudi-padwa","slug":"gudi-padwa","name":"गुड़ी पड़वा","what":"गुड़ी पड़वा चइत शुक्ल प्रतिपदा के मराठी आ कोंकणी नया साल होला। हर घर के बाहर एगो गुड़ी खड़ा कइल जाला: बाँस के डंडा, जवना पर चमकदार रेशमी कपड़ा, नीम आ आम के पत्ता, मिसरी के माला आ सबसे ऊपर उलटा राखल ताँबा भा चानी के लोटा होला; ओकर पूजा होला आ सूर्यास्त पर ओकरा उतारल जाला। दुआर पर रंगोली बनावल जाला, नीम के पत्ता आ गुड़ के तीत-मीठ लेप खाइल जाला, आ पूरन पोली आ श्रीखंड बनावल जाला। सिंधी घर में एही दिन चेटी चंड होला आ कश्मीर में नवरेह।","rule":"गुड़ी पड़वा (उत्तर में मनावल जाला) चइत शुक्ल प्रतिपदा (पूर्णिमांत महीना के नाँव) के पड़ेला; दिन ऊ लिहल जाला जेकरा सूर्योदय पर ई तिथि होखे।","conventionNote":"उदय नियम। शुक्ल प्रतिपदा पूर्णिमांत आ अमांत गणना में एके दिन होला आ इंजन में विक्रम संवत (शक + 135) के शुरुआत करेला।","review":"draft"},
  {"id":"festival-chaitra-navratri","slug":"chaitra-navratri","name":"चइती नवरात","what":"चइती नवरात चइत शुक्ल प्रतिपदा से नवमी ले नौ दिन चलेला आ रामनवमी के संगे खतम होला। एकर शुरुआत घटस्थापना से होला, कलश के स्थापना आ जौ के बोआई, प्रतिपदा में जब ऊ सूर्योदय के बाद चलत होखे, भा जब ऊ जल्दी खतम हो जाए त अभिजित में। हर दिन दुर्गा के एक रूप के समर्पित बा, अखंड दीया, फल, दूध आ बिना अन्न के खाना पर उपवास, आ दुर्गा सप्तशती के पाठ के संगे। अष्टमी के कन्या पूजा आ हवन होला। उत्तर में जौ के जयी दसवाँ दिन बाँटल जाला; महाराष्ट्र आ दक्खिन में एही नौ दिन शांत ढंग से राखल जाला, आ राम के जनमदिन ओकर शिखर होला।","rule":"चइती नवरात चइत शुक्ल प्रतिपदा से नवमी ले (पूर्णिमांत महीना के नाँव) चलेला, हर दिन सूर्योदय के तिथि से लिहल जाला, एह से कवनो तिथि के क्षय भा वृद्धि होखला पर अवधि आठ भा दस दिन के हो सकेला।","conventionNote":"प्रतिपदा से नवमी ले अवधि-नियम; अवधि के भीतर क्षय भा वृद्धि तिथि एकर लंबाई आठ से दस कैलेंडर दिन के बीच बदल देला। शुक्ल पक्ष, एह से पूर्णिमांत आ अमांत में कवनो फरक नइखे।","review":"draft"},
  {"id":"festival-gangaur","slug":"gangaur","name":"गणगौर (गौरी तृतीया)","what":"गणगौर राजस्थान के गौरी (पार्वती) के बसंत के पर्व होला, जे होली के अगिला दिन से शुरू होके सोलह दिन के पूजा के बाद चइत शुक्ल तृतीया के खतम होला। ईसर आ गौरी के माटी के मूरति के हर भोरे सजावल जाला आ उनकर गीत गावल जाला; अंतिम दू दिन उनका के माथ पर पानी के घइला सँभारत जुलूस में कुआँ भा झील ले ले जाके विसर्जित कइल जाला। बरत राखे वाला लोग, परंपरा से जवान आ नया बियाहल, गीत आ बरत के आगे रहेला, आ दिन घेवर आ चूरमा के खाना के संगे खतम होला। जयपुर आ उदयपुर में बड़ सार्वजनिक जुलूस निकलेला।","rule":"गणगौर (गौरी तृतीया) (उत्तर में मनावल जाला) चइत शुक्ल तृतीया (पूर्णिमांत महीना के नाँव) के पड़ेला; दिन ऊ लिहल जाला जेकरा सूर्योदय पर ई तिथि होखे।","conventionNote":"समापन के तृतीया पर उदय नियम; सोलह दिन के गिनती होली के अगिला दिन से शुरू होला। शुक्ल पक्ष, एह से पूर्णिमांत आ अमांत में कवनो फरक नइखे। मुख्य रूप से राजस्थान में मनावल जाला आ उत्तर क्षेत्र के सूची में बा।","review":"draft"},
  {"id":"festival-kamada-ekadashi","slug":"kamada-ekadashi","name":"कामदा एकादशी","what":"कामदा एकादशी पूर्णिमांत गणना में हिंदू साल के पहिला एकादशी होला, चइत शुक्ल एकादशी के, रामनवमी के दू दिन बाद। अन्न छोड़ल, तुलसी आ दीया के संगे विष्णु पूजा, आ पाठ भा जप के दिन, सब आम विधि के हिसाब से चलेला; वराह पुराण एकर कथा गंधर्व ललित के माध्यम से कहेला। पारन अगिला भोरे द्वादशी तिथि के भीतर, हरि वासर के बाद आ दिन के पाँचवाँ हिस्सा बीतला से पहिले होला। ढेर लोग चौबीस एकादशी के साल भर के क्रम एहिजे से, रात भर विष्णु के आगे दीया के संगे, शुरू करेला।","rule":"कामदा एकादशी चइत शुक्ल एकादशी (पूर्णिमांत महीना के नाँव) के पड़ेला; दिन ऊ लिहल जाला जेकरा सूर्योदय पर ई तिथि होखे, आ अगर तिथि दू दिन ओह समय पर रहे त बाद वाला दिन लिहल जाला; अगर अगिला द्वादशी कवनो सूर्योदय के ना छुवे, त बरत ओही दिन रहेला जवना दिन एकादशी शुरू भइल, जेसे पारन द्वादशी के भीतर पड़े।","conventionNote":"एकादशी नियम, स्मार्त आ वैष्णव दुनो तारीख देखावल जाला। शुक्ल पक्ष, एह से पूर्णिमांत आ अमांत में कवनो फरक नइखे।","review":"draft"},
  {"id":"festival-hanuman-jayanti","slug":"hanuman-jayanti","name":"हनुमान जयंती","what":"हनुमान जयंती उत्तर में चइत पूर्णिमा के पड़ेला आ सूर्योदय से हनुमान चालीसा, सुंदरकांड आ कवनो हनुमान मंदिर में सेनुर, तेल, बूंदी के लड्डू आ लाल फूल चढ़ावे के संगे राखल जाला। ढेर लोग दिन भर बरत राखेला भा एक बेर खाला; कुश्ती के अखाड़ा प्रदर्शन राखेला आ कुछ मंदिर दिन भर के पाठ चलावेला। लाल आ नारंगी एह दिन के रंग होला। दूसरा क्षेत्र में हनुमान के जनम दूसरा समय पर भी राखल जाला (तमिल आ कन्नड़ तारीख देखीं), एह से पंचांग स्थानीय परंपरा देखावेला।","rule":"हनुमान जयंती (उत्तर में मनावल जाला) चइत शुक्ल पूर्णिमा (पूर्णिमांत महीना के नाँव) के पड़ेला; दिन ऊ लिहल जाला जेकरा सूर्योदय पर ई तिथि होखे।","conventionNote":"चइत पूर्णिमा पर उदय नियम, उत्तर भारत के तारीख। तमिलनाडु हनुमथ जयंती मार्गळि अमावस्या के राखेला (दक्खिन खातिर अलग सूची में) आ कर्नाटक आ आंध्र बइसाख कृष्ण दशमी के, जे मॉडल में नइखे।","review":"draft"},